ID	LABEL	comment	see also	alternative label	IEDB alternative term	has cross-reference	SubClass Of	Equivalent Class	definition	part of	derives from	has part
CL:0000000	cell	"The definition of cell is intended to represent all cells, and thus a cell is defined as a material entity and not an anatomical structure, which implies that it is part of an organism (or the entirety of one)."	EFO_URI: http://www.ebi.ac.uk/efo/EFO_0000324			"CALOHA:TS-2035|CALOHA:TS-2035|FBbt:00007002|FMA:68646|FMA:68646 |GO:0005623|GO:0005623|KUPO:0000002|KUPO:0000002|MESH:D002477|NCIt:C12508|NCIt:C48694|VHOG:0001533|VHOG:0001533|MESH:D002477|NCIt:C12508|NCIt:C48694|VHOG:0001533|VHOG:0001533|MESH:D002477|NCIt:C12508|NCIt:C48694|VHOG:0001533|VHOG:0001533|ZFA:0009000"""	anatomical structure		A material entity of anatomical origin (part of or deriving from an organism) that has as its parts a maximally connected cell compartment surrounded by a plasma membrane.			
CL:0000003	native cell	"To accommodate unicellular organisms better, 'cell in vivo' has been re-labeled 'native cell' to better represent its intended meaning - that is, that it is a cell in the context of a multicellular organism or in a natural environment. 'Native' is intended to contrast with 'in vitro', which refers to cells or other biological entities that have been intentionally placed in a controlled, non-natural setting for the purpose of study or manipulation. (MAH 1.12.12)."				CARO:0000013	cell		"A cell that is found in a natural setting, which includes multicellular organism cells 'in vivo' (i.e. part of an organism), and unicellular organisms 'in environment' (i.e. part of a natural environment)."			
CL:0000010	cultured cell	"Note that this class was re-labeled to 'cultured cell' instead of 'cell line cell', as it intent was clarified to cover any cultured cells of multicellular and unicellular organisms. This includes cells actively being cultured, or cells that have been cultured but are stored in a quiescent state for future use. In having been cultured, cells must establish homeostasis and often replicate in a foreign environment. Accomodation of this stress initiates a selection of cells fit for such challenges, wherein necessary adaptive biochemical and.or genetic changes can occur. These changes can set them apart from the in vivo cells from which they derive, and such changes will typically accumulate and change over increasing time in culture."				MESH:D002478|MO:562|MeSH:D002460|NCIt:C16403	cell		A cell in vitro that is or has been maintained or propagated as part of a cell culture.			
CL:0000017	spermatocyte				Sperm cell	BTO:0001275|CALOHA:TS-0951|EMAPA:31484|FBbt:00004936|FMA:84049|WBbt:0006799|ZFA:0009005	germ cell		A male germ cell that develops from spermatogonia. The euploid primary spermatocytes undergo meiosis and give rise to the haploid secondary spermatocytes which in turn give rise to spermatids.			
CL:0000023	oocyte					BTO:0000964|CALOHA:TS-0711|FBbt:00004886|FMA:18644|MESH:D009865|WBbt:0006797|ZFA:0001109	eukaryotic cell|germ cell		A female germ cell that has entered meiosis.			
CL:0000031	neuroblast (sensu Vertebrata)				Neuroblast	BTO:0000930|FMA:70563|ZFA:0009011	eukaryotic cell|non-terminally differentiated cell		A cell that will develop into a neuron often after a migration phase.			
CL:0000034	stem cell	"This term applies to metazoan. For plant stem cells, consider using PO:0004011 ‘initial cell’ or its parent PO:0004010 ‘meristematic cell’."				CALOHA:TS-2086|FMA:63368|ZFA:0005957	eukaryotic cell|precursor cell		A relatively undifferentiated cell that retains the ability to divide and proliferate throughout life to provide progenitor cells that can differentiate into specialized cells.			
CL:0000055	non-terminally differentiated cell	define using PATO mulit-potent or oligopotent?				BTO:0000125|FMA:84782	precursor cell		A precursor cell with a limited number of potential fates.			
CL:0000057	fibroblast	"These cells may be vimentin-positive, fibronectin-positive, fsp1-positive, MMP-1-positive, collagen I-positive, collagen III-positive, and alpha-SMA-negative."				BTO:0000452|CALOHA:TS-0362|FMA:63877|NCIT:C12482|VHOG:0001482|ZFA:0009026	connective tissue cell		A connective tissue cell which secretes an extracellular matrix rich in collagen and other macromolecules. Flattened and irregular in outline with branching processes; appear fusiform or spindle-shaped.			
CL:0000062	osteoblast	non-encoded relationships from VSAO - capable_of_producing VSAO:0000020				BTO:0001593|CALOHA:TS-0720|FMA:66780|ZFA:0009031	connective tissue cell|non-terminally differentiated cell|progenitor cell		"Skeletogenic cell that secretes osteoid, is capable of producing mineralized (hydroxyapatite) matrix, is located adjacent to or within osteoid tissue, and arises from the transformation of a preosteoblast cell."			
CL:0000066	epithelial cell					BTO:0000414|CALOHA:TS-2026|CARO:0000077|FBbt:00000124|FMA:66768|WBbt:0003672|ZFA:0009034	eukaryotic cell|part_of some tissue		A cell that is usually found in a two-dimensional sheet with a free surface. The cell has a cytoskeleton that allows for tight cell to cell contact and for cell polarity where apical part is directed towards the lumen and the basal part to the basal lamina.	tissue		
CL:0000081	blood cell					FMA:62844|MESH:D001773|ZFA:0009044	hematopoietic cell		A cell found predominately in the blood.			
CL:0000084	T cell					BTO:0000782|CALOHA:TS-1001|FMA:62870|MESH:D013601|VHOG:0001479|ZFA:0009046	lymphocyte		A type of lymphocyte whose defining characteristic is the expression of a T cell receptor complex.			
CL:0000094	granulocyte					BTO:0000539|BTO:0001026|CALOHA:TS-0422|FMA:62854|ZFA:0009048	blood cell|has_part some 'anatomical structure'|myeloid leukocyte		A leukocyte with abundant granules in the cytoplasm.			anatomical structure
CL:0000097	mast cell	"Mast cells are generally integrin beta-7-negative and positive for TLR2, TLR3, TLR4, TLR5, TLR7, TLR9, C3aR, C5aR, CR3, CR4, VEGF, FGF2, and renin. They can express MHC Class I and II on their surface. Activated murine mast cells (IgE+Antigen) were capable of expressing the following co-stimulatory molecules: CD95 (Fas), CD120b, CD137 (4-1BB), CD153 (CD30L), CD154 (CD40L), GITR, ICOSL, OX40L, PD-L1, and PD-L2. Note that there was some mouse strain variation. Mast cells have also been demonstrated to produce bFGF, CCL2, CCL4, CCL5, CCL11, CCL20, CXCL2, CXCL8, CXCL10, GM-CSF, IFN-gamma, IL-1, IL-2, IL-3, IL-8, IL-10, IL-11, IL-12, IL-13, IL-16, IL-25, IL-18, MIP-1, prostaglandin D2, SCF, TGF-beta, TNF-alpha, TSLP, VEGF, and XCL1. They express the transcription factors Transcription factors AP-1, GATA1, MITF, Notch2, PIAS3, PU.1, and STAT5."				BTO:0000830|CALOHA:TS-0603|FMA:66784	biogenic amine secreting cell|has_part some 'anatomical structure'|myeloid leukocyte		"A cell that is found in almost all tissues containing numerous basophilic granules and capable of releasing large amounts of histamine and heparin upon activation. Progenitors leave bone marrow and mature in connective and mucosal tissue. Mature mast cells are found in all tissues, except the bloodstream. Their phenotype is CD117-high, CD123-negative, CD193-positive, CD200R3-positive, and FceRI-high. Stem-cell factor (KIT-ligand; SCF) is the main controlling signal of their survival and development."			anatomical structure
CL:0000113	mononuclear phagocyte					BTO:0001433|ZFA:0009064|https://cellxgene.cziscience.com/cellguide/CL_0000113	mononuclear cell|stuff accumulating cell		A vertebrate phagocyte with a single nucleus.			
CL:0000115	endothelial cell	"From FMA: 9.07.2001: Endothelial cell has always been classified as a kind of epithelial cell, specifically a squamous cell but that is not true. First, endothelial cell can either be squamous or cuboidal (e.g. high-endothelial cell) and secondly, it has different embryological derivation (mesodermal) than a true epithelial cell (ectodermal and endodermal). The basis for present classification is the fact that it comprises the outermost layer or lining of anatomical structures (location-based) but a better structural basis for the differentia is the cytoskeleton of the cell. Endothelial cell has vimentin filaments while an epithelial cell has keratin filaments. [Onard]."				BTO:0001176|CALOHA:TS-0278|FMA:66772|ZFA:0009065	eukaryotic cell		"An endothelial cell comprises the outermost layer or lining of anatomical structures and can be squamous or cuboidal. In mammals, endothelial cell has vimentin filaments and is derived from the mesoderm."			
CL:0000125	glial cell	"Not all glial cells develop from glioblasts, with microglia developing from the mesoderm instead. See https://github.com/obophenotype/cell-ontology/issues/1571"				BTO:0002606|CALOHA:TS-0415|FBbt:00005144|FMA:54536|ZFA:0009073|https://cellxgene.cziscience.com/cellguide/CL_0000125	neural cell		"A non-neuronal cell of the nervous system. They not only provide physical support, but also respond to injury, regulate the ionic and chemical composition of the extracellular milieu. Guide neuronal migration during development, and exchange metabolites with neurons."			
CL:0000127	astrocyte	"Astrocytes are reportedly CD68-negative, CD121a-positive, CD184-positive, CD192-positive, CRF-positive, EGFR-positive, GFAP-positive, GLUT1-positive, MBP-negative, and NGFR-positive."				BTO:0000099|CALOHA:TS-0060|FMA:54537|ZFA:0009075	glial cell		"A class of large neuroglial (macroglial) cells in the central nervous system - the largest and most numerous neuroglial cells in the brain and spinal cord. Astrocytes (from 'star' cells) are irregularly shaped with many long processes, including those with 'end feet' which form the glial (limiting) membrane and directly and indirectly contribute to the blood-brain barrier. They regulate the extracellular ionic and chemical environment, and 'reactive astrocytes' (along with microglia) respond to injury."			
CL:0000145	professional antigen presenting cell	"Note change of name; nearly all somatic cells can present antigens to T cells via MHC Class I complexes leading to effector responses, but professional antigen presenting cells constitutively express MHC Class II as well as costimulatory molecules, and thus can initiate immune responses via T cells."				ZFA:0009088	leukocyte		A cell capable of processing and presenting lipid and protein antigens to T cells in order to initiate an immune response.			
CL:0000148	melanocyte					BTO:0000847|CALOHA:TS-0613|FMA:70545|MESH:D008544|VHOG:0001679|ZFA:0009091|https://cellxgene.cziscience.com/cellguide/CL_0000148	eukaryotic cell|has_part some 'anatomical structure'|stuff accumulating cell		"A pigment cell derived from the neural crest. Contains melanin-filled pigment granules, which gives a brown to black appearance."			anatomical structure
CL:0000151	secretory cell					BTO:0003659|FMA:86916	cell		A cell that specializes in controlled release of one or more substances.			
CL:0000163	endocrine cell					FMA:83809|ZFA:0009096	eukaryotic cell|part_of some 'material anatomical entity'|secretory cell		"A cell of an endocrine gland, ductless glands that secrete substances which are released directly into the circulation and which influence metabolism and other body functions."	material anatomical entity		
CL:0000164	enteroendocrine cell					BTO:0003865|FMA:62930|MESH:D019858|ZFA:0009097|https://cellxgene.cziscience.com/cellguide/CL_0000164	endocrine cell|epithelial cell		An endocrine cell that is located in the epithelium of the gastrointestinal tract or in the pancreas.			
CL:0000169	type B pancreatic cell	"Pancreatic beta cells are also reportedly CD284-positive. Upon activation, they upregulate their CD14 expression."			Pancreatic beta cell	BTO:0000783|EV:0200009|FMA:70586|MA:0002419|ZFA:0009102|ncithesaurus:Beta_Cell	enteroendocrine cell|part_of some 'compound organ'|part_of some 'multi-tissue structure'|part_of some pancreas		A cell that secretes insulin and is located towards the center of the islets of Langerhans.	compound organ|multi-tissue structure|pancreas		
CL:0000182	hepatocyte	Hepatocytes are reportedly MHC Class I-positive and MHC Class II-positive.				BTO:0000575|CALOHA:TS-0454|FMA:14515|ZFA:0009111|https://cellxgene.cziscience.com/cellguide/CL_0000182	epithelial cell|part_of some liver		"The main structural component of the liver. They are specialized epithelial cells that are organized into interconnected plates called lobules. Majority of cell population of liver, polygonal in shape, arranged in plates or trabeculae between sinusoids; may have single nucleus or binucleated."	liver		
CL:0000187	muscle cell					BTO:0000888|BTO:0000902|CALOHA:TS-2032|FBbt:00005074|FMA:67328|WBbt:0003675|ZFA:0009114	electrically responsive cell|eukaryotic cell		"A mature contractile cell, commonly known as a myocyte. This cell has as part of its cytoplasm myofibrils organized in various patterns."			
CL:0000211	electrically active cell					ZFA:0009128	cell		A cell whose function is determined by the generation or the reception of an electric signal.			
CL:0000219	motile cell					ZFA:0009136	cell		A cell that moves by its own activities.			
CL:0000221	ectodermal cell					FMA:72549|ZFA:0009137	embryonic cell (metazoa)|eukaryotic cell|part_of some embryo|part_of some tissue		A cell of the outer of the three germ layers of the embryo.	embryo|tissue		
CL:0000232	erythrocyte					BTO:0000424|CALOHA:TS-0290|FMA:81100	blood cell|myeloid cell		"A red blood cell. In mammals, mature erythrocytes are biconcave disks containing hemoglobin whose function is to transport oxygen."			
CL:0000233	platelet	"Platelets are reportedly CCR1-positive, CCR2-negative, CCR3-positive, CCR4-positive, CCR5-negative, CCR6-negative, CCR7-negative, CCR8-negative, CCR9-negative, CCR10-negative, CD16-positive, CD23-positive, CD32-positive, CD40-positive, CD41-positive CD42-positive, CD61-positive, CD62P-positive, CD64-positive, CD89-positive, CD102-positive, CD147-positive (activated platelets), CD154-positive (activated platelets), CD162-positive, CD209, CD282-positive, CD284-positive, CD289-positive, CD181-negative, CD182-negative, CD183-negative, CD184-positive, CLEC2-positive, GPVI-positive, JAMC-positive, PAR1-positive, PAR2-negative, PAR3-positive, PAR4-positive, TSP1-positive, and TXA2R-positive. Platelets can reportedly produce CCL2, CCL3, CCL5, CCL7, CCL17, CD40L, CXCL1, CXCL4, CXCL4L1, CXCL5, CXCL7, CXCL8, CXCL12, EGF, factor V, factor VII, factor XI, factor XIII, bFGF, histamine, IGF-1, IL-1beta, PAI-1, PDGF, plasminogen, protein S, serotonin, TGF-beta, TFPI, VEGF, and vWF."				BTO:0000132|CALOHA:TS-0803|FMA:62851	biogenic amine secreting cell|blood cell|myeloid cell		"A non-nucleated disk-shaped cell formed by extrusion from megakaryocytes, found in the blood of all mammals, and mainly involved in blood coagulation."			
CL:0000235	macrophage	"Morphology: Diameter 30_M-80 _M, abundant cytoplasm, low N/C ratio, eccentric nucleus. Irregular shape with pseudopods, highly adhesive. Contain vacuoles and phagosomes, may contain azurophilic granules; markers: Mouse & Human: CD68, in most cases CD11b. Mouse: in most cases F4/80+; role or process: immune, antigen presentation, & tissue remodelling; lineage: hematopoietic, myeloid."				BTO:0000801|CALOHA:TS-0587|FMA:63261|FMA:83585|MESH:D008264|ZFA:0009141	mononuclear phagocyte|myeloid leukocyte|professional antigen presenting cell		"A mononuclear phagocyte present in variety of tissues, typically differentiated from monocytes, capable of phagocytosing a variety of extracellular particulate material, including immune complexes, microorganisms, and dead cells."			
CL:0000236	B cell					BTO:0000776|CALOHA:TS-0068|FMA:62869|MESH:D001402|VHOG:0001480|ZFA:0009142	lymphocyte of B lineage		A lymphocyte of B lineage that is capable of B cell mediated immunity.			
CL:0000255	eukaryotic cell					MESH:D005057	cell		Any cell that in taxon some Eukaryota.			
CL:0000325	stuff accumulating cell						cell		A cell that is specialised to accumulate a particular substance(s).			
CL:0000393	electrically responsive cell					ZFA:0009190	electrically active cell		A cell whose function is determined by its response to an electric signal.			
CL:0000451	dendritic cell					BTO:0002042|CALOHA:TS-0194|FMA:83036|MESH:D003713|ZFA:0009209	mononuclear phagocyte|professional antigen presenting cell		"A cell of hematopoietic origin, typically resident in particular tissues, specialized in the uptake, processing, and transport of antigens to lymph nodes for the purpose of stimulating an immune response via T cell activation. These cells are lineage negative (CD3-negative, CD19-negative, CD34-negative, and CD56-negative)."			
CL:0000457	biogenic amine secreting cell					ZFA:0009212	secretory cell					
CL:0000540	neuron	These cells are also reportedly CD4-negative and CD200-positive. They are also capable of producing CD40L and IFN-gamma.				BTO:0000938|CALOHA:TS-0683|FBbt:00005106|FMA:54527|VHOG:0001483|WBbt:0003679|ZFA:0009248	electrically responsive cell|neural cell		"The basic cellular unit of nervous tissue. Each neuron consists of a body, an axon, and dendrites. Their purpose is to receive, conduct, and transmit impulses in the nervous system."			
CL:0000542	lymphocyte	Editors note: consider adding taxon constraint to vertebrata (PMID:18025161)				BTO:0000775|CALOHA:TS-0583|FMA:62863|MESH:D008214|VHOG:0001535|ZFA:0009250	mononuclear cell		"A lymphocyte is a leukocyte commonly found in the blood and lymph that has the characteristics of a large nucleus, a neutral staining cytoplasm, and prominent heterochromatin."			
CL:0000576	monocyte	"Morphology: Mononuclear cell, diameter, 14 to 20 _M, N/C ratio 2:1-1:1. Nucleus may appear in variety of shapes: round, kidney, lobulated, or convoluted. Fine azurophilic granules present; markers: CD11b (shared with other myeloid cells), human: CD14, mouse: F4/80-mid,GR1-low; location: Blood, but can be recruited into tissues; role or process: immune & tissue remodelling; lineage: hematopoietic, myeloid."				BTO:0000876|CALOHA:TS-0638|FMA:62864|ZFA:0009265	mononuclear phagocyte|myeloid leukocyte|progenitor cell		"Myeloid mononuclear recirculating leukocyte that can act as a precursor of tissue macrophages, osteoclasts and some populations of tissue dendritic cells."			
CL:0000586	germ cell					BTO:0000535|NCIT:C12597|VHOG:0001534|WBbt:0006796	cell		The reproductive cell in multicellular organisms.			
CL:0000623	natural killer cell					BTO:0000914|BTO:0004716|CALOHA:TS-0664|FMA:63147|FMA:83601|MESH:D007694|VHOG:0001697|ZFA:0009278	lymphocyte		A lymphocyte that can spontaneously kill a variety of target cells without prior antigenic activation via germline encoded activation receptors and also regulate immune responses via cytokine release and direct contact with other cells.			
CL:0000624	"CD4-positive, alpha-beta T cell"						mature alpha-beta T cell		A mature alpha-beta T cell that expresses an alpha-beta T cell receptor and the CD4 coreceptor.			
CL:0000625	"CD8-positive, alpha-beta T cell"						mature alpha-beta T cell		A T cell expressing an alpha-beta T cell receptor and the CD8 coreceptor.			
CL:0000738	leukocyte					BTO:0000751|CALOHA:TS-0549|FMA:62852|MESH:D007962|NCIT:C12529|ZFA:0009309	eukaryotic cell|hematopoietic cell|motile cell|nucleate cell|part_of some 'material anatomical entity'		"An achromatic cell of the myeloid or lymphoid lineages capable of ameboid movement, found in blood or other tissue."	material anatomical entity		
CL:0000763	myeloid cell					BTO:0001441|CALOHA:TS-0647|MESH:D022423|ZFA:0009324	eukaryotic cell|hematopoietic cell		"A cell of the monocyte, granulocyte, mast cell, megakaryocyte, or erythroid lineage."			
CL:0000766	myeloid leukocyte					ZFA:0009326	leukocyte|myeloid cell		"A cell of the monocyte, granulocyte, or mast cell lineage."			
CL:0000767	basophil	"Matures in the bone marrow and account for <1% of leukocytes in the peripheral blood, spleen, and bone marrow. Basophils are described as being CD11a-positive, CD11b-positive, CD13-positive, CD15-positive, CD18-positive, CD21-positive, CD25-positive, CD29-positive, CD35-positive, CD40-positive, CD40L-positive, CD44-positive, CD45R-negative, CD46-positive, CD49a-positive, CD49b-positive, CD49d-positive, CD55-positive, CD59-positive, CD62L-positive, CD63-positive, CD69-positive, CD90-negative, CD116-positive, CD117-negative, CD124-positive, CD125-positive, CD131-positive, CD161-positive, CD184-positive, CD191-positive, CD192-positive, CD197-positive, CD200R3-positive, CD218-positive, CD282-positive, CD284-positive, CD289-positive, CD290-positive, CD294-positive, natural killer cell receptor 2B4-positive, smad1-positive, CD3-negative, CD4-negative, CD7-negative, CD8-negative, CD14-negative, CD15-negative, CD16-negative, CD19-negative, CD20-negative, CD34-negative, CD36-negative, CD45R-negative, CD56-negative, CD57-negative, CD235a-negative, and GR1-negative. Transcription factors- GATA1-positive, PU.1-positive."				BTO:0000129|CALOHA:TS-0073|FMA:62862	granulocyte		"Any of the immature or mature forms of a granular leukocyte that in its mature form has an irregularly shaped, pale-staining nucleus that is partially constricted into two lobes, and with cytoplasm that contains coarse, bluish-black granules of variable size. Basophils contain vasoactive amines such as histamine and serotonin, which are released on appropriate stimulation. A basophil is CD123-positive, CD193-positive, CD203c-positive, and FceRIa-positive."			
CL:0000775	neutrophil					BTO:0000130|CALOHA:TS-0688|FMA:62860|MESH:D009504|ZFA:0009327	granulocyte		"Any of the immature or mature forms of a granular leukocyte that in its mature form has a nucleus with three to five lobes connected by slender threads of chromatin, and cytoplasm containing fine inconspicuous granules and stainable by neutral dyes."			
CL:0000786	plasma cell	"Plasma cells develop in the spleen and migrate to the bone marrow. Plasma cells are also reportedly CD5-negative, CD10-negative, CD19-positive, CD20-negative, CD21-negative, CD22-negative, CD23-negative, CD24-negative, CD25-negative, CD27-positive, CD34-negative, CD38-positive, CD40-positive, CD43-positive, CD45-positive, CD48-positive, CD53-low, CD80-negative, CD81-positive, CD86-positive, CD95-positive, CD196-negative, CD229-positive, CD270-positive, CD352-positive, CD361-positive, and IgD-negative. Transcription factors: BLIMP1-positive, IRF4-positive, PAX5-negative, SpiB-negative, Ets1-negative, and XBP1-positive."				BTO:0000392|FMA:70574|MESH:D010950|ZFA:0009332	lymphocyte of B lineage		"A terminally differentiated, post-mitotic, antibody secreting cell of the B cell lineage with the phenotype CD138-positive, surface immunonoglobulin-negative, and MHC Class II-negative. Plasma cells are oval or round with extensive rough endoplasmic reticulum, a well-developed Golgi apparatus, and a round nucleus having a characteristic cartwheel heterochromatin pattern and are devoted to producing large amounts of immunoglobulin."			
CL:0000791	mature alpha-beta T cell						T cell		A alpha-beta T cell that has a mature phenotype.			
CL:0000798	gamma-delta T cell	Note that gamma-delta T cells have both thymic and extrathymic differentiation pathways.				ZFA:0009336	T cell		A T cell that expresses a gamma-delta T cell receptor complex.			
CL:0000814	mature NK T cell				NKT cells		mature alpha-beta T cell		A mature alpha-beta T cell of a distinct lineage that bears natural killer markers and a T cell receptor specific for a limited set of ligands. NK T cells have activation and regulatory roles particularly early in an immune response.			
CL:0000835	myeloblast					BTO:0000187|FMA:83524|ZFA:0009353	has_part some 'anatomical structure'|myeloid cell|progenitor cell		"The most primitive precursor in the granulocytic series, having fine, evenly distributed chromatin, several nucleoli, a high nuclear-to-cytoplasmic ration (5:1-7:1), and a nongranular basophilic cytoplasm. They reside in the bone marrow."			anatomical structure
CL:0000842	mononuclear cell					BTO:0000878|CALOHA:TS-0768|FMA:86713|ZFA:0009357	has_part some 'anatomical structure'|leukocyte		A leukocyte with a single non-segmented nucleus in the mature form.			anatomical structure
CL:0000893	thymocyte					BTO:0001372|CALOHA:TS-1042|FMA:72202|MESH:D060168|XAO:0003159	T cell|part_of some thymus		An immature T cell located in the thymus.	thymus		
CL:0000945	lymphocyte of B lineage	Types of B lineage lymphocytes include B cells and antibody secreting cells (plasmablasts and plasma cells).  Lymphocytes of B cell lineage can be distinguished from those of T cell lineage by their lack of CD3e (as part of the T cell receptor complex).					lymphocyte		A lymphocyte of B lineage with the commitment to express an immunoglobulin complex.			
CL:0000988	hematopoietic cell					BTO:0000574|CALOHA:TS-2017|FMA:70366|FMA:83598|ZFA:0005830	cell		A cell of a hematopoietic lineage.			
CL:0002242	nucleate cell					FMA:67513	cell		A cell containing at least one nucleus.			
CL:0002319	neural cell					CALOHA:TS-2040|FMA:70333	eukaryotic cell		A cell that is part of the nervous system.			
CL:0002320	connective tissue cell					CALOHA:TS-2096|FMA:63875|MESH:D003239|ZFA:0009392	eukaryotic cell|part_of some 'connective tissue'	cell and (part_of some 'connective tissue')	"A cell of the supporting or framework tissue of the body, arising chiefly from the embryonic mesoderm and including adipose tissue, cartilage, and bone."	connective tissue|connective tissue		
CL:0002321	embryonic cell (metazoa)					CALOHA:TS-0263|FMA:82840|WBbt:0007028|ZFA:0007089|https://cellxgene.cziscience.com/cellguide/CL_0002321	cell		A cell of the embryo.			
