ID	LABEL	comment	see also	alternative label	IEDB alternative term	has cross-reference	SubClass Of	Equivalent Class	definition	part of	derives from	has part
UBERON:0000178	blood					AAO:0000046|BTO:0000089|CALOHA:TS-0079|EFO:0000296|EHDAA2:0000176|EHDAA:418|EMAPA:16332|ENVO:02000027|EV:0100047|FMA:9670|GAID:965|MA:0000059|MESH:D001769|MIAA:0000315|NCIT:C12434|OpenCyc:Mx4rvVjI8JwpEbGdrcN5Y29ycA|TAO:0000007|UMLS:C0005767|VHOG:0000224|Wikipedia:Blood|XAO:0000124|ZFA:0000007|galen:Blood|http://en.wikipedia.org/wiki/Blood|http://linkedlifedata.com/resource/umls/id/C0005767	anatomical structure|bodily fluid|has_part some 'bodily fluid'|has_part some 'native cell'|has_part some erythrocyte		A fluid that is composed of blood plasma and erythrocytes.			bodily fluid|erythrocyte|native cell
UBERON:0000310	breast					BTO:0000149|CALOHA:TS-2083|EV:0100124|FMA:9601|GAID:33|MESH:D001940|NCIT:C12971|OpenCyc:Mx4rvVjV7ZwpEbGdrcN5Y29ycA|SCTID:181131000|UMLS:C0006141|Wikipedia:Breast|galen:Breast|http://en.wikipedia.org/wiki/Breast|http://linkedlifedata.com/resource/umls/id/C0006141|http://www.snomedbrowser.com/Codes/Details/181131000	anatomical structure|has_part some 'anatomical conduit'|has_part some 'bodily fluid'|has_part some 'connective tissue'|has_part some 'epithelial cell'|has_part some 'muscle structure'|has_part some 'organ part'|has_part some 'organ system subdivision'|has_part some organ		The upper ventral region of the torso of an organism.			anatomical conduit|bodily fluid|connective tissue|epithelial cell|muscle structure|organ|organ part|organ system subdivision
UBERON:0000456	secretion of exocrine gland					AEO:0001005|BTO:0002977|BTO:0002979|EMAPA:36535|FMA:9675|MA:0002504|MESH:D012634|NCIT:C34062|UMLS:C1516992|galen:Secretion	organism substance		A portion of organism substance that is produced by exocrine glands.			
UBERON:0000463	organism substance					AAO:0010839|AEO:0000004|BILA:0000004|CALOHA:TS-2101|CARO:0000004|EHDAA2:0003004|EMAPA:35178|FBbt:00007019|FMA:9669|HAO:0000004|MA:0002450|NCIT:C13236|SPD:0000008|TAO:0001487|TGMA:0001824|VHOG:0001726|XAO:0004001|ZFA:0001487|galen:BodySubstance	material anatomical entity		"Material anatomical entity in a gaseous, liquid, semisolid or solid state; produced by anatomical structures or derived from inhaled and ingested substances that have been modified by anatomical structures as they pass through the body."			
UBERON:0000465	material anatomical entity					AAO:0010264|AEO:0000006|BILA:0000006|CARO:0000006|EHDAA2:0003006|FBbt:00007016|FMA:67165|HAO:0000006|TAO:0001836|TGMA:0001826|VHOG:0001721			Anatomical entity that has mass.			
UBERON:0000473	testis					AAO:0000606|BILA:0000124|BSA:0000085|BTO:0001363|CALOHA:TS-1030|EFO:0000984|EHDAA2:0002007|EHDAA:8146|EMAPA:17972|EV:0100102|FBbt:00004928|FMA:7210|GAID:396|HAO:0001007|MA:0000411|MAT:0000132|MESH:D013737|MIAA:0000132|NCIT:C12412|OpenCyc:Mx4rvVjM25wpEbGdrcN5Y29ycA|SCTID:181431007|TAO:0000598|UMLS:C0039597|VHOG:0000252|WBbt:0006794|Wikipedia:Testis|XAO:0000157|ZFA:0000598|galen:Testis|http://en.wikipedia.org/wiki/Testis|http://linkedlifedata.com/resource/umls/id/C0039597|http://www.snomedbrowser.com/Codes/Details/181431007	gonad		A gonad of a male animal. A gonad produces and releases sperm.			
UBERON:0000479	tissue					AAO:0000607|AAO:0010054|AEO:0000043|BILA:0000043|BIRNLEX:19|CALOHA:TS-2090|CARO:0000043|EHDAA2:0003043|EMAPA:35868|FBbt:00007003|FMA:9637|HAO:0000043|MA:0003002|MESH:D014024|NCIT:C12801|TAO:0001477|TGMA:0001844|UMLS:C0040300|VHOG:0001757|WBbt:0005729|XAO:0003040|ZFA:0001477|galen:Tissue|http://linkedlifedata.com/resource/umls/id/C0040300	anatomical structure|has_part some cell		"Multicellular anatomical structure that consists of many cells of one or a few types, arranged in an extracellular matrix such that their long-range organisation is at least partly a repetition of their short-range organisation."			cell
UBERON:0000481	multi-tissue structure					AAO:0010048|AEO:0000055|BILA:0000055|CARO:0000055|EHDAA2:0003055|FBbt:00007010|HAO:0000055|TAO:0001488|TGMA:0001847|VHOG:0001762|XAO:0003037|ZFA:0001488	anatomical structure|has_part some tissue		Anatomical structure that has as its parts two or more portions of tissue of at least two different types and which through specific morphogenetic processes forms a single distinct structural unit demarcated by bona-fide boundaries from other distinct structural units of different types.			tissue
UBERON:0000489	cavitated compound organ					AAO:0010016|AEO:0000072|BILA:0000072|CARO:0000072|EHDAA2:0003072|FMA:55671|HAO:0000072|TAO:0001490|TGMA:0001857|VHOG:0001730|XAO:0003165|ZFA:0001490	compound organ		Compound organ that contains one or more macroscopic anatomical spaces.			
UBERON:0000922	embryo		https://github.com/obophenotype/uberon/issues/503			AAO:0011035|AEO:0000169|BILA:0000056|BSA:0000039|BTO:0000379|CALOHA:TS-0229|EFO:0001367|EHDAA2:0000002|EHDAA2_RETIRED:0003236|EHDAA:38|EMAPA:16039|FBbt:00000052|FMA:69068|GAID:963|IDOMAL:0000646|MAT:0000226|MESH:D004622|MIAA:0000019|NCIT:C28147|OGEM:000001|OpenCyc:Mx4rwP1ceZwpEbGdrcN5Y29ycA|SCTID:57991002|UMLS:C0013935|VHOG:0001766|Wikipedia:Embryo|XAO:0000113|ZFA:0000103|http://en.wikipedia.org/wiki/Embryo|http://linkedlifedata.com/resource/umls/id/C0013935|http://neurolex.org/wiki/Category:Embryonic_organism|http://neurolex.org/wiki/Category:Embryonic_organism|http://www.snomedbrowser.com/Codes/Details/57991002	anatomical structure|has_part some cell		"Anatomical entity that comprises the organism in the early stages of growth and differentiation that are characterized by cleavage, the laying down of fundamental tissues, and the formation of primitive organs and organ systems. For example, for mammals, the process would begin with zygote formation and end with birth. For insects, the process would begin at zygote formation and end with larval hatching. For plant zygotic embryos, this would be from zygote formation to the end of seed dormancy. For plant vegetative embryos, this would be from the initial determination of the cell or group of cells to form an embryo until the point when the embryo becomes independent of the parent plant."			cell
UBERON:0000945	stomach					AAO:0000579|ANISEED:1235297|BTO:0001307|CALOHA:TS-0980|EFO:0000837|EHDAA2:0001915|EHDAA:2993|EMAPA:17021|EV:0100070|FMA:7148|GAID:293|MA:0000353|MAT:0000051|MESH:A03.492.766|MESH:D013270|MIAA:0000051|NCIT:C12391|OpenCyc:Mx4rvVjlqpwpEbGdrcN5Y29ycA|SCTID:181246003|TAO:0002121|UMLS:C0038351|VHOG:0000408|Wikipedia:Stomach|XAO:0000128|galen:Stomach|http://en.wikipedia.org/wiki/Stomach|http://linkedlifedata.com/resource/umls/id/C0038351|http://www.snomedbrowser.com/Codes/Details/181246003	digestive system element|part_of some 'alimentary part of gastrointestinal system'|part_of some 'subdivision of digestive tract'|subdivision of digestive tract		"An expanded region of the vertebrate alimentary tract that serves as a food storage compartment and digestive organ. A stomach is lined, in whole or in part by a glandular epithelium."	alimentary part of gastrointestinal system|subdivision of digestive tract		
UBERON:0000947	aorta					AAO:0010213|BTO:0000135|CALOHA:TS-0046|EFO:0000265|EMAPA:18601|EV:0100027|FMA:3734|GAID:469|MA:0000062|MAT:0000035|MESH:D001011|MIAA:0000035|NCIT:C12669|OpenCyc:Mx4rvVjvTpwpEbGdrcN5Y29ycA|SCTID:181298001|UMLS:C0003483|VHOG:0001523|Wikipedia:Aorta|XAO:0003010|galen:Aorta|http://en.wikipedia.org/wiki/Aorta|http://linkedlifedata.com/resource/umls/id/C0003483|http://www.snomedbrowser.com/Codes/Details/181298001	blood vessel|part_of some 'organ system subdivision'		"The main trunk of the systemic arterial system that carries blood from the heart to all the organs and other structures of the body, bringing oxygenated blood to all parts of the body in the systemic circulation."	organ system subdivision		
UBERON:0000948	heart	"Taxon notes:"" the ascidian tube-like heart lacks chambers....The ascidian heart is formed after metamorphosis as a simple tube-like structure with a single-layered myoepithelium that is continuous with a single-layered pericar- dial wall. It lacks chambers and endocardium.... The innovation of the chambered heart was a key event in vertebrate evolution, because the chambered heart generates one-way blood flow with high pressure, a critical requirement for the efficient blood supply of large-body vertebrates... all extant vertebrates have hearts with two or more chambers (Moorman and Christoffels 2003)"" DOI:10.1101/gad.1485706"				AAO:0010210|BILA:0000020|BTO:0000562|CALOHA:TS-0445|EFO:0000815|EHDAA2:0000738|EHDAA:420|EMAPA:16105|EV:0100018|FMA:7088|GAID:174|MA:0000072|MAT:0000036|MESH:D006321|MIAA:0000036|NCIT:C12727|OpenCyc:Mx4rvVjvDpwpEbGdrcN5Y29ycA|SCTID:302509004|TAO:0000114|UMLS:C0018787|VHOG:0000276|Wikipedia:Heart|XAO:0000064|ZFA:0000114|galen:Heart|http://en.wikipedia.org/wiki/Heart|http://linkedlifedata.com/resource/umls/id/C0018787|http://www.snomedbrowser.com/Codes/Details/302509004	compound organ|has_part some 'eukaryotic cell'|has_part some 'native cell'|has_part some 'organ part'|part_of some 'thoracic cavity element'|thoracic segment organ		A myogenic muscular circulatory organ found in the vertebrate cardiovascular system composed of chambers of cardiac muscle. It is the primary circulatory organ.	thoracic cavity element		eukaryotic cell|native cell|organ part
UBERON:0000955	brain					AAO:0010478|ABA:Brain|BAMS:Br|BAMS:Brain|BILA:0000135|BIRNLEX:796|BTO:0000142|CALOHA:TS-0095|DHBA:10155|EFO:0000302|EHDAA2:0000183|EHDAA:2641|EHDAA:6485|EMAPA:16894|EV:0100164|FBbt:00005095|FMA:50801|GAID:571|HBA:4005|MA:0000168|MAT:0000098|MBA:8|MBA:997|MESH:D001921|MIAA:0000098|NCIT:C12439|OpenCyc:Mx4rvVjT65wpEbGdrcN5Y29ycA|PBA:3999|SCTID:258335003|TAO:0000008|UMLS:C0006104|UMLS:C1269537|VHOG:0000157|Wikipedia:Brain|XAO:0000010|ZFA:0000008|galen:Brain|http://braininfo.rprc.washington.edu/centraldirectory.aspx?ID=21|http://braininfo.rprc.washington.edu/centraldirectory.aspx?ID=21|http://en.wikipedia.org/wiki/Brain|http://linkedlifedata.com/resource/umls/id/C0006104|http://linkedlifedata.com/resource/umls/id/C1269537|http://www.snomedbrowser.com/Codes/Details/258335003|neuronames:21	has_part some 'native cell'|has_part some 'neural cell'|organ|part_of some 'central nervous system'		"The brain is the center of the nervous system in all vertebrate, and most invertebrate, animals. Some primitive animals such as jellyfish and starfish have a decentralized nervous system without a brain, while sponges lack any nervous system at all. In vertebrates, the brain is located in the head, protected by the skull and close to the primary sensory apparatus of vision, hearing, balance, taste, and smell[WP]."	central nervous system		native cell|neural cell
UBERON:0000970	eye					BILA:0000017|BTO:0000439|CALOHA:TS-0309|EFO:0000827|EV:0100336|FBbt:00005162|GAID:69|MAT:0000140|MESH:D005123|MIAA:0000140|OpenCyc:Mx4rvViTvpwpEbGdrcN5Y29ycA|Wikipedia:Eye|http://en.wikipedia.org/wiki/Eye	has_part some 'native cell'|has_part some 'stuff accumulating cell'|has_part some neuron|sense organ		An organ that detects light.			native cell|neuron|stuff accumulating cell
UBERON:0000991	gonad					AAO:0000213|BILA:0000123|BSA:0000079|BTO:0000534|EMAPA:17383|FBbt:00004858|FMA:18250|GAID:368|HAO:0000379|MA:0002420|MESH:D006066|NCIT:C12725|OpenCyc:Mx4rwQvdiZwpEbGdrcN5Y29ycA|SCTID:304623008|TAO:0000413|UMLS:C0018067|VHOG:0000397|WBbt:0005175|Wikipedia:Gonad|XAO:0003146|ZFA:0000413|http://en.wikipedia.org/wiki/Gonad|http://linkedlifedata.com/resource/umls/id/C0018067|http://www.snomedbrowser.com/Codes/Details/304623008	has_part some 'germ cell'|has_part some 'native cell'|reproductive organ	'reproductive organ' and (has_part some 'germ cell')	Reproductive organ that produces and releases eggs (ovary) or sperm (testis).			germ cell|germ cell|native cell
UBERON:0000992	ovary					AAO:0000371|BILA:0000125|BSA:0000080|BTO:0000975|CALOHA:TS-0730|EFO:0000973|EHDAA2:0001360|EHDAA:8124|EMAPA:17962|EV:0100111|FBbt:00004865|FMA:7209|GAID:367|MA:0000384|MESH:D010053|MIAA:0000125|NCIT:C12404|OpenCyc:Mx4rvVi9QJwpEbGdrcN5Y29ycA|SCTID:181464007|TAO:0000403|UMLS:C0029939|VHOG:0000251|Wikipedia:Ovary|XAO:0000258|ZFA:0000403|http://en.wikipedia.org/wiki/Ovary|http://linkedlifedata.com/resource/umls/id/C0029939|http://www.snomedbrowser.com/Codes/Details/181464007	gonad		The gonad of a female organism which contains germ cells.			
UBERON:0000995	uterus					BTO:0001424|CALOHA:TS-1102|EFO:0000975|EMAPA:29915|EV:0100113|FMA:17558|GAID:172|MA:0000389|MAT:0000127|MESH:D014599|MIAA:0000127|NCIT:C12405|OpenCyc:Mx4rvViojJwpEbGdrcN5Y29ycA|SCTID:181452004|UMLS:C0042149|VHOG:0001137|Wikipedia:Uterus|galen:Uterus|http://en.wikipedia.org/wiki/Uterus|http://linkedlifedata.com/resource/umls/id/C0042149|http://www.snomedbrowser.com/Codes/Details/181452004	part_of some 'reproductive organ'|reproductive structure|subdivision of tube		The female muscular organ of gestation in which the developing embryo or fetus is nourished until birth.	reproductive organ		
UBERON:0001013	adipose tissue					AAO:0000001|AEO:000020|BTO:0001487|CALOHA:TS-0013|EFO:0000790|EHDAA2:0003120|EMAPA:35112|EV:0100381|FMA:20110|GAID:920|MA:0000009|MAT:0000015|MESH:D000273|MIAA:0000015|NCIT:C12472|OpenCyc:Mx4rvVjc_ZwpEbGdrcN5Y29ycA|SCTID:55603005|TAO:0002134|UMLS:C0001527|VHOG:0001284|Wikipedia:Adipose_tissue|XAO:0003049|ZFA:0005345|galen:FattyTissue|http://en.wikipedia.org/wiki/Adipose_tissue|http://linkedlifedata.com/resource/umls/id/C0001527|http://www.snomedbrowser.com/Codes/Details/55603005	connective tissue|has_part some 'connective tissue cell'|has_part some 'native cell'|has_part some 'stuff accumulating cell'		Portion of connective tissue composed of adipocytes enmeshed in areolar tissue.			connective tissue cell|native cell|stuff accumulating cell
UBERON:0001017	central nervous system					AAO:0000090|BAMS:CNS|BILA:0000080|BIRNLEX:1099|BTO:0000227|CALOHA:TS-0150|EFO:0000908|EHDAA2:0000225|EHDAA:828|EMAPA:16470|EMAPA:16754|EV:0100163|FBbt:00005094|FMA:55675|GAID:570|MA:0000167|MAT:0000457|MESH:D002490|NCIT:C12438|OpenCyc:Mx4rvzYt3pwpEbGdrcN5Y29ycA|SCTID:278199004|TAO:0000012|UMLS:C0927232|VHOG:0000293|Wikipedia:Central_nervous_system|XAO:0000215|ZFA:0000012|http://braininfo.rprc.washington.edu/centraldirectory.aspx?ID=854|http://braininfo.rprc.washington.edu/centraldirectory.aspx?ID=854|http://en.wikipedia.org/wiki/Central_nervous_system|http://linkedlifedata.com/resource/umls/id/C0927232|http://www.snomedbrowser.com/Codes/Details/278199004|neuronames:854	organ system subdivision		The central nervous system is the core nervous system that serves an integrating and coordinating function. In vertebrates it consists of the neural tube derivatives: the brain and spinal cord. In invertebrates it includes central ganglia plus nerve cord.			
UBERON:0001043	esophagus					AAO:0000145|ANISEED:1235301|BTO:0000959|CALOHA:TS-0700|EFO:0000835|EHDAA2:0001285|EHDAA:2937|EMAPA:16833|EV:0100069|FMA:7131|GAID:291|MA:0000352|MAT:0000048|MESH:A03.365|MESH:D004947|MIAA:0000048|NCIT:C12389|OpenCyc:Mx4rvVj9Q5wpEbGdrcN5Y29ycA|SCTID:181245004|TAO:0000204|UMLS:C0014876|VHOG:0000450|Wikipedia:Esophagus|XAO:0000127|ZFA:0000204|galen:Esophagus|http://en.wikipedia.org/wiki/Esophagus|http://linkedlifedata.com/resource/umls/id/C0014876|http://www.snomedbrowser.com/Codes/Details/181245004	digestive system element|part_of some 'subdivision of digestive tract'|subdivision of digestive tract|thoracic cavity element		"Tube that connects the pharynx to the stomach. In mammals, the oesophagus connects the buccal cavity with the stomach. The stratified squamous non-keratinised epithelium lining the buccal cavity is continued through the pharynx down into the oesophagus. The lowest part of the oesophagus (ca. 2 cm) is lined with gastric mucosa and covered by peritoneum. The main body of the oesophagus is lined with small, simple mucous glands. Each gland opens into the lumen by a long duct which pierces the muscularis mucosae (Wilson and Washington, 1989). A sphincter is situated at the point where the oesophagus enters the stomach to prevent gastro-oesophageal reflux, i.e. to prevent acidic gastric contents from reaching stratified epithelia of the oesophagus, where they can cause inflammation and irritation (Wilson and Washington, 1989; Brown et al., 1993)."	subdivision of digestive tract		
UBERON:0001044	saliva-secreting gland					BTO:0001203|CALOHA:TS-0892|EFO:0000859|EHDAA2:0001775|EHDAA:7987|EMAPA:17751|EV:0100059|FBbt:00005382|FMA:9597|GAID:937|MA:0000346|MAT:0000079|MESH:D012469|MIAA:0000079|NCIT:C12426|OpenCyc:Mx4rvVjl5ZwpEbGdrcN5Y29ycA|SCTID:181236000|UMLS:C0036098|VHOG:0000376|Wikipedia:Salivary_gland|galen:SalivaryGland|http://en.wikipedia.org/wiki/Salivary_gland|http://linkedlifedata.com/resource/umls/id/C0036098|http://www.snomedbrowser.com/Codes/Details/181236000	digestive system element|exocrine gland|part_of some 'subdivision of digestive tract'		Saliva-secreting exocrine glands of the oral cavity[GO].	subdivision of digestive tract		
UBERON:0001052	rectum					AAO:0010401|BTO:0001158|CALOHA:TS-1180|EFO:0000848|EHDAA2:0001592|EHDAA:5836|EMAPA:17896|EV:0100081|FMA:14544|GAID:311|MA:0000336|MAT:0000050|MESH:A03.492.411.495.767|MESH:D012007|MIAA:0000050|NCIT:C12390|OpenCyc:Mx4rvVjaU5wpEbGdrcN5Y29ycA|SCTID:181261002|UMLS:C0034896|VHOG:0001751|Wikipedia:Rectum|XAO:0000238|galen:Rectum|http://en.wikipedia.org/wiki/Rectum|http://linkedlifedata.com/resource/umls/id/C0034896|http://www.snomedbrowser.com/Codes/Details/181261002	part_of some 'alimentary part of gastrointestinal system'|part_of some 'digestive system element'|part_of some 'multi-tissue structure'|part_of some 'subdivision of digestive tract'|subdivision of digestive tract		"The terminal portion of the intestinal tube, terminating with the anus."	alimentary part of gastrointestinal system|digestive system element|multi-tissue structure|subdivision of digestive tract		
UBERON:0001088	urine					BTO:0001419|CALOHA:TS-1092|EFO:0001939|EMAPA:36554|ENVO:00002047|FMA:12274|GAID:1189|MA:0002545|MAT:0000058|MESH:D014556|MIAA:0000058|NCIT:C13283|OpenCyc:Mx4rvVjGppwpEbGdrcN5Y29ycA|UMLS:C0042036|Wikipedia:Urine|galen:Urine	excreta		Excretion that is the output of a kidney.			
UBERON:0001090	synovial fluid					BTO:0001339|CALOHA:TS-0996|ENVO:02000039|FMA:12277|GAID:265|MA:0002544|MESH:D013582|NCIT:C33718|TAO:0005154|UMLS:C0039097|Wikipedia:Synovial_fluid|ZFA:0005154|galen:SynovialFluid	secretion of serous gland|transudate		Joint fluid is a transudate of plasma that is actively secreted by synovial cells.			
UBERON:0001155	colon					AAO:0010400|BTO:0000269|CALOHA:TS-0158|EFO:0000361|EMAPA:18939|EV:0100079|FMA:14543|GAID:309|MA:0000335|MAP:0000001|MAT:0000526|MESH:A03.492.411.495.356|MESH:D003106|NCIT:C12382|OpenCyc:Mx4rvgLEM5wpEbGdrcN5Y29ycA|SCTID:302508007|TAO:0000706|UMLS:C0009368|VHOG:0000648|Wikipedia:Colon_(anatomy)|XAO:0000243|ZFA:0000706|galen:Colon|http://en.wikipedia.org/wiki/Colon_(anatomy)|http://linkedlifedata.com/resource/umls/id/C0009368|http://www.snomedbrowser.com/Codes/Details/302508007	part_of some 'alimentary part of gastrointestinal system'|part_of some 'digestive system element'|part_of some 'subdivision of digestive tract'|subdivision of digestive tract		"A portion of the large intestine before it becomes the rectum. In mammals, the colon is the most part of the large intestine, excluding the vermiform appendix, the rectum and the anal canal."	alimentary part of gastrointestinal system|digestive system element|subdivision of digestive tract		
UBERON:0001255	urinary bladder					AAO:0000623|BTO:0001418|CALOHA:TS-1090|EFO:0000290|EHDAA2:0000174|EHDAA:9328|EMAPA:18321|EV:0100098|FMA:15900|GAID:0000004|MA:0000380|MAT:0000122|MESH:A05.810.161|MESH:D001743|MIAA:0000122|NCIT:C12414|OpenCyc:Mx4rvVjMmZwpEbGdrcN5Y29ycA|SCTID:302512001|UMLS:C0005682|VHOG:0000740|Wikipedia:Urinary_bladder|XAO:0000154|galen:UrinaryBladder|http://en.wikipedia.org/wiki/Urinary_bladder|http://linkedlifedata.com/resource/umls/id/C0005682|http://www.snomedbrowser.com/Codes/Details/302512001	bladder organ|part_of some 'organ system subdivision'|viscus		Distensible musculomembranous organ situated in the anterior part of the pelvic cavity in which urine collects before excretion[MP].	organ system subdivision		
UBERON:0001264	pancreas					AAO:0010112|BTO:0000988|CALOHA:TS-0736|EFO:0000855|EHDAA2:0001367|EHDAA:6893|EMAPA:17503|EV:0100092|FMA:7198|GAID:334|MA:0000120|MAT:0000075|MESH:D010179|MIAA:0000075|NCIT:C12393|OpenCyc:Mx4rvVimZZwpEbGdrcN5Y29ycA|SCTID:181277001|TAO:0000140|UMLS:C0030274|VHOG:0000050|Wikipedia:Pancreas|XAO:0000136|ZFA:0000140|galen:Pancreas|http://en.wikipedia.org/wiki/Pancreas|http://linkedlifedata.com/resource/umls/id/C0030274|http://www.snomedbrowser.com/Codes/Details/181277001	has_part some 'enteroendocrine cell'|has_part some 'multi-tissue structure'|has_part some 'native cell'|viscus		An endoderm derived structure that produces precursors of digestive enzymes and blood glucose regulating enzymes[GO].|An endoderm derived structure that produces precursors of digestive enzymes and blood glucose regulating hormones[GO].			enteroendocrine cell|multi-tissue structure|native cell
UBERON:0001268	peritoneal fluid					BTO:0001031|EMAPA:35683|FMA:16515|MA:0002531|MESH:D001202|Wikipedia:Peritoneal_fluid|ncithesaurus:Peritoneal_Fluid	secretion of serous gland|transudate		Transudate contained in the peritoneal cavity.			
UBERON:0001359	cerebrospinal fluid					BIRNLEX:1798|BTO:0000237|CALOHA:TS-0130|EFO:0000329|EHDAA2:0004441|ENVO:02000029|EV:0100311|FMA:20935|GAID:1181|MA:0002503|MAT:0000499|MESH:D002555|NCIT:C12692|TAO:0002184|UMLS:C0007806|VHOG:0001278|Wikipedia:Cerebrospinal_fluid|ZFA:0001626	transudate		"A clear, colorless, bodily fluid, that occupies the subarachnoid space and the ventricular system around and inside the brain and spinal cord."			
UBERON:0001474	bone element					AAO:0000047|AEO:0000082|BTO:0000140|CALOHA:TS-0088|EFO:0000298|EHDAA2:0003082|EMAPA:32782|ENVO:00002039|EV:0100140|FMA:30317|FMA:5018|GAID:92|MA:0001459|MAT:0000299|MIAA:0000299|NCIT:C12366|OpenCyc:Mx4rvViDlpwpEbGdrcN5Y29ycA|OpenCyc:Mx4rvVkCG5wpEbGdrcN5Y29ycA|SCTID:90780006|TAO:0001514|UMLS:C0262950|VHOG:0001190|VSAO:0000057|Wikipedia:Bone|XAO:0000169|ZFA:0001514|galen:Bone|http://en.wikipedia.org/wiki/Bone|http://linkedlifedata.com/resource/umls/id/C0262950|http://www.snomedbrowser.com/Codes/Details/90780006	has_part some 'connective tissue'|organ|part_of some 'organ system subdivision'		Skeletal element that is composed of bone tissue.	organ system subdivision		connective tissue
UBERON:0001723	tongue					AAO:0010360|BTO:0001385|CALOHA:TS-1050|EFO:0000833|EHDAA2:0002062|EHDAA:9144|EMAPA:17185|EV:0100058|FMA:54640|GAID:816|MA:0000347|MAT:0000040|MESH:D014059|MIAA:0000040|NCIT:C12422|OpenCyc:Mx4rvVjmJ5wpEbGdrcN5Y29ycA_53KXLq9EdqAAAACs6hnmQ|SCTID:181226008|TAO:0005333|UMLS:C0040408|VHOG:0000419|Wikipedia:Tongue|XAO:0000446|ZFA:0005333|http://en.wikipedia.org/wiki/Tongue|http://linkedlifedata.com/resource/umls/id/C0040408|http://www.snomedbrowser.com/Codes/Details/181226008	digestive system element|part_of some 'subdivision of digestive tract'|sense organ		A muscular organ in the floor of the mouth.	subdivision of digestive tract		
UBERON:0001729	oropharynx					BTO:0005257|CALOHA:TS-0718|EFO:0001976|EHDAA2:0004082|EMAPA:25094|EV:0100067|FMA:54879|GAID:340|MA:0000351|MAT:0000446|MESH:D009960|NCIT:C12762|SCTID:263376008|UMLS:C0521367|VHOG:0000457|VSAO:0000034|Wikipedia:Oropharynx|XAO:0004048	part_of some 'alimentary part of gastrointestinal system'|part_of some 'subdivision of digestive tract'|subdivision of tube		The portion of the pharynx that lies between the soft palate and the upper edge of the epiglottis.	alimentary part of gastrointestinal system|subdivision of digestive tract		
UBERON:0001737	larynx					AAO:0000268|BTO:0001208|CALOHA:TS-0532|EFO:0000838|EHDAA2:0004063|EMAPA:18333|EV:0100039|FMA:55097|GAID:108|MA:0000414|MAT:0000187|MESH:D007830|MIAA:0000187|NCIT:C12420|OpenCyc:Mx4rvViOnZwpEbGdrcN5Y29ycA|SCTID:181212004|UMLS:C0023078|VHOG:0001279|Wikipedia:Larynx|XAO:0003081|galen:Larynx|http://en.wikipedia.org/wiki/Larynx|http://linkedlifedata.com/resource/umls/id/C0023078|http://www.snomedbrowser.com/Codes/Details/181212004	part_of some 'compound organ'|subdivision of tube		"A continuation of the pharynx that is involved in breathing, sound production, and protecting the trachea against food aspiration."	compound organ		
UBERON:0001744	lymphoid tissue					BTO:0000753|CALOHA:TS-0584|FMA:55220|GAID:342|MA:0002436|MESH:D008221|NCIT:C13049|SCTID:181768009|UMLS:C0024296|Wikipedia:Lymphoid_tissue|galen:LymphoidTissue|http://en.wikipedia.org/wiki/Lymphoid_tissue|http://linkedlifedata.com/resource/umls/id/C0024296|http://www.snomedbrowser.com/Codes/Details/181768009	has_part some 'native cell'|has_part some lymphocyte|tissue		"Portion of connective tissue with various types of white blood cells enmeshed in it, most numerous being the lymphocytes[WP]."			lymphocyte|native cell
UBERON:0001836	saliva					BTO:0001202|CALOHA:TS-0891|EMAPA:36536|ENVO:02000036|FMA:59862|GAID:1167|MA:0002507|MAT:0000444|MESH:D012463|NCIT:C13275|UMLS:C0036087|Wikipedia:Saliva|galen:Saliva	secretion of exocrine gland		"A fluid produced in the oral cavity by salivary glands, typically used in predigestion, but also in other functions."			
UBERON:0001961	mucosa-associated lymphoid tissue					FMA:62819|MA:0000140|NCIT:C12910|UMLS:C0599921|Wikipedia:Mucosa-associated_lymphoid_tissue	lymphoid tissue		"Diffuse system of small concentrations of lymphoid tissue found in various sites of the body such as the gastrointestinal tract, thyroid, breast, lung, salivary glands, eye, and skin[WP]. Mucosal-associated lymphoid tissue is typically found as nodules associated with mucosal epithelia with distinct internal structures including B- and T-zones for the activation of lymphocytes[GO]."			
