ID	LABEL	comment	see also	alternative label	IEDB alternative term	has cross-reference	SubClass Of	Equivalent Class	definition	part of	derives from	has part
CLO:0037020	LC-2-ad cell		Sanger: COSMIC ID:907786	LC-2-ad			immortal human lung-derived cell line cell					
CLO:0037061	SU-DHL-4 cell		DSMZ: ACC 495	SU-DHL-4			immortal human lymphocyte cell line cell					
CLO:0037063	SU-DHL-6 cell		DSMZ: ACC 572	SU-DHL-6			immortal human lymphocyte cell line cell					
CLO:0037068	WSU-DLCL2 cell		DSMZ: ACC 575	WSU-DLCL2|WSUDLCL2			immortal human lymphocyte cell line cell					
CLO:0037104	TYK-nu cell		JHSF: JCRB0234.0	TYK-nu|TYKNU			immortal fibroblast cell line cell|immortal human cell line cell					
CLO:0037107	KP-2 cell		JHSF: JCRB0181	KP-2			immortal human pancreas-derived cell line cell					
CLO:0037108	KP-3 cell		JHSF: JCRB0178.0	KP-3			immortal human pancreas-derived cell line cell					
CLO:0037114	SUIT-2 cell		JHSF: JCRB1094	SUIT-2			immortal human pancreas-derived cell line cell					
CLO:0037132	MZ2-MEL cell		Sanger: COSMIC ID:971777	MZ2-MEL			immortal human skin-derived cell line cell					
CLO:0037135	UACC-257 cell		Sanger: COSMIC ID:905977	UACC-257			immortal human skin-derived cell line cell					
CLO:0037144	NUGC-3 cell		JHSF: JCRB0822	NUGC-3			immortal human stomach-derived cell line cell					
CLO:0037159	LB831-BLC cell		Sanger: COSMIC ID:753584	LB831-BLC			immortal human urinary bladder-derived cell line cell					
CLO:0037173	JJN-3 cell		DSMZ: ACC 541	JJN-3			immortal human bone marrow-derived cell line cell					
CLO:0037180	MCF12A cell		ATCC: CRL-10782	MCF-12A cell|MCF12A			immortal human breast-derived cell line cell					
CLO:0037194	immortal human breast epithelial cell line cell						immortal human breast-derived cell line cell|immortal human epithelial cell line cell		An immortal human epithelial cell line cell that derives from human breast.			
CLO:0037201	RMA cell		OBI: OBI_1110038|RRID: CVCL_J385				immortal T cell line cell|immortal mouse cell line cell		"An immortal mouse T cell line cell derived from a mouse lymphoma, specifically a Rauscher virus-induced tumor.This cell line is antigen processing-defective and expresses a very low level of MHC molecules on its surface."			
CLO:0037202	JY cell		RRID: CVCL_0108				immortal human B cell line cell|immortal human cell line cell					
CLO:0037203	MM.1S cell		RRID: CVCL_8792				immortal human B cell line cell|immortal human cell line cell					
CLO:0037204	LSCC-RP9 cell		RRID: CVCL_T444				immortal B cell line cell		immortal chicken B cell line cell derives_from some B cell from the peritoneal sac of a chicken having leukosis			
CLO:0037205	UCI 107 cell		RRID: CVCL_5381				immortal human cell line cell|immortal human epithelial cell line cell		immortal human epithelial cell line cell  derives_from some ovary epithelial cell from a patient having ovary serous adenocarcinoma			
CLO:0037206	UCI 101 cell		RRID: CVCL_5380				immortal human cell line cell|immortal human epithelial cell line cell		immortal human epithelial cell line cell  derives_from some ovary epithelial cell from a patient having ovary serous adenocarcinoma			
CLO:0037235	immortal human pancreas-derived epithelial cell line cell						derives_from some 'native cell'|immortal human cell line cell|immortal human pancreas-derived cell line cell		An immortal pancreas-derived cell line cell that derives from human.		native cell	
CLO:0037236	immortal human kidney-derived epithelial cell line cell						derives_from some 'native cell'|immortal human kidney-derived cell line cell		An immortal kidney-derived cell line cell that derives from human.		native cell	
CLO:0037256	HBL-1 cell		BAO: BAO_0030037|BTO: BTO_0002522|RRID:CVCL_4213				immortal human B cell line cell|immortal human cell line cell		"HBL-1 (aka human is an EBV-negative B-cell lymphoma cell line established from the pleural effusion of a patient with malignant lymphoma, diffuse, large cell."			
CLO:0037272	TMD8 cell		BAO: BAO_0030064|RRID:CVCL_A442				immortal human B cell line cell|immortal human cell line cell		Human diffuse large B cell lymphoma cell line derived from a 62-year-old male patient			
CLO:0050045	RCB0455 cell	"Derived from tissue: lung in animal: human.|Originator: Kataoka, Hiroaki|Register: Itoh, Hiroshi"		LC-1/sq|RCB0455			immortal human lung-derived cell line cell		A immortal human cell line cell that has the characteristics: Parent cell line of LC/sq-SFthe same patient as RCB0439 LC-F. Cell growth is slow.			
CLO:0050048	RCB0725 cell	"Derived from tissue: lung in animal: human.|Originator: Masuda, Noriyuki|Register: Iguchi, Haruo"		MS-1|RCB0725			immortal human cell line cell		A immortal human cell line cell that has the characteristics: Small lung carcinoma. PTHrP producing.			
CLO:0050049	RCB1905 cell	"Derived from tissue: lung in animal: human.|Originator: Kobayashi, SyunsukeS. (Tohoku Univ.)|Register: Obinata, Masuo"		RCB1905|Sq-1			immortal human cell line cell		A immortal human cell line cell that has the characteristics: Human cell line derived from lung squamous cell carcinoma. Many granules are found in cytoplasma. HLA-A 11/24. TKG0301 (Deposited from Tohoku Univ.).			
CLO:0050057	RCB2818 cell	"Derived from tissue: lung in animal: human.|Originator: Yasumoto, Kosei|Register: Yasumoto, Kosei"		B1203L|RCB2818			immortal human cell line cell		"A immortal human cell line cell that has the characteristics: Human cell line derived from lung adenocarcinoma. HLA A2402/2402, B5201/5401, C0102/1202."			
CLO:0050059	RCB1967 cell	"Derived from tissue: lung in animal: human.|Register: Obinata, Masuo"	JHSF: JCRB0079	LU65|RCB1967			immortal human lung-derived cell line cell		A immortal human cell line cell that has the characteristics: Human lung carcinoma cell line. TKG0442(Deposited from Tohoku Univ.).			
CLO:0050067	RCB4455 cell	"Derived from tissue: lung in animal: human.|Originator: Tsuji, K. & Hayata, Y.|Register: Nakamura, Yukio"	: MGH-889	PC-9|RCB4455			immortal human cell line cell		A immortal human cell line cell that has the characteristics: Human cell line derived from lung adenocarcinoma cells. Differentiated type. <a href='http://www.brc.riken.go.jp/lab/cell/english/rcb0446_announce.shtml'>Previous name:PC-14(RCB0446) </a>			
CLO:0050083	RCB2293 cell	"Derived from tissue: malignant pleural mesothelioma, pleural fluid in animal: human.|Originator: Hida, Toyoaki|Register: Sekido, Yoshitaka"		ACC-MESO-4|RCB2293			immortal human cell line cell		A immortal human cell line cell that has the characteristics: Human malignant pleural mesothelioma cell line.			
CLO:0050104	RCB2138 cell	"Derived from tissue: pancreas in animal: human.|Originator: Kobari, M.|Register: Obinata, Masuo"		KLM-1|RCB2138			immortal human cell line cell		A immortal human cell line cell that has the characteristics: Human cell line derived from pancreatic cancer. RCB1972 is derived from the same patient. TKG0490 (Deposited from Tohoku Univ.).			
CLO:0050107	RCB2141 cell	"Derived from tissue: pancreas in animal: human.|Originator: Kobori, M.|Register: Obinata, Masuo"		PK-45P|RCB2141			immortal human cell line cell		A immortal human cell line cell that has the characteristics: Human cell line derived from pancreatic carcinoma. RCB1973 is derived from the same patient. TKG0493(Deposited from Tohoku Univ.).			
CLO:0050150	RCB0980 cell	"Derived from tissue: upper gingiva in animal: human.|Originator: Harada, Masakazu|Register: Harada, Masakazu"		RCB0980|Sa3			immortal human cell line cell		A immortal human cell line cell that has the characteristics: Squamous carcinoma cells derived from human oral cancer.			
CLO:0050164	RCB0193 cell	"Derived from tissue: myeloma, subcutaneous in animal: human.|Originator: Namba, Masayoshi|Register: Huh, Nam, Ho"		KMM-1|RCB0193			immortal mouse cell line cell		A immortal mouse cell line cell that has the characteristics: Human myeloma. Lambda- chain producing.			
CLO:0050192	RCB2652 cell	"Derived from tissue: ascites in animal: mouse, BALB/c.|Originator: Peter, Ralph|Register: Fukuda, Hiroshi"		J774-1|RCB2652			immortal mouse cell line cell		A immortal mouse cell line cell that has the characteristics: Mouse cell line derived from ascites. Macrophage-like cells. BALB/c strain. TKG0208(Deposited from Tohoku Univ.).			
CLO:0050238	RCB1830 cell	"Derived from tissue: connective tissue in animal: rat.|Register: Kubo, Yoshinao"		RCB1830|Rat-1			immortal connective tissue cell line cell		A immortal connective tissue cell line cell that has the characteristics: Rat fibroblast-like cell line that can be transformed by oncogenes.			
CLO:0050752	RCB1283 cell	"Derived from tissue: skin in animal: mouse, C57BL/6.|Register: Hamada, Hirofumi"		B16 melanoma|RCB1283			immortal mouse skin-derived cell line cell		A immortal mouse skin-derived cell line cell that has the characteristics: Mouse melanoma producing melanin.			
CLO:0050789	RCB1939 cell	"Derived from tissue: stomach in animal: human.|Register: Obinata, Masuo"	CHEMBL: CHEMBL3307267|CVCL: CVCL_3082|JHSF: JCRB0834	NUGC-4|RCB1939			immortal human stomach-derived cell line cell		A immortal human stomach-derived cell line cell that has the characteristics: Human cell line derived from signet ring cell carcinoma of stomach. TKG0449 (Deposited from Tohoku Univ.).			
CLO:0050802	RCB1434 cell	"Derived from tissue: stomach, lymph node meta in animal: human.|Originator: Yamashita, Kazuya|Register: Uesugi, Hidenaga"		KE-39|RCB1434			immortal human stomach-derived cell line cell		A immortal human stomach-derived cell line cell that has the characteristics: Human cell line derived from gastric cancer			
CLO:0050853	RCB1942 cell	"Derived from tissue: liver in animal: human.|Originator: Nakabayashi, H.|Register: Obinata, Masuo"		HuH-7|RCB1942			immortal human liver-derived cell line cell		A immortal human liver-derived cell line cell that has the characteristics: Human cell line derived from hepatoma. TKG0206 (Deposited from Tohoku Univ.).			
CLO:0050890	RCB1151 cell	"Derived from tissue: kidney in animal: human.|Originator: Hashizaki, K.|Register: Ohno, Tadao"	CHEMBL: CHEMBL3308302|CVCL: CVCL_1647|Sanger: COSMIC ID:909974	RCB1151|RCC10RGB			immortal human kidney-derived cell line cell		A immortal human kidney-derived cell line cell that has the characteristics: Kidney carcinoma from a Japanese patient. Cell growth is slow.			
CLO:0050893	RCB1963 cell	"Derived from tissue: kidney in animal: human.|Originator: Akiyama, M.|Register: Obinata, Masuo"	JHSF: JCRB0813	RCB1963|VMRC-RCW			immortal human kidney-derived cell line cell		A immortal human kidney-derived cell line cell that has the characteristics: Human renal cell carcinoma cell line. TKG0447(Deposited from Tohoku Univ.).			
CLO:0050894	RCB2202 cell	"Derived from tissue: kidney in animal: human.|Register: Miyoshi, Hiroyuki"	RRID: CVCL_0063	293T|RCB2202			derives_from some HEK293|immortal human cell line cell|immortal human kidney-derived epithelial cell line cell		A immortal human kidney-derived cell line cell that has the characteristics: Human cell line expressing SV40 large T antigen abundantly.|immortal human kidney-derived cell line cell that was derived from some human kidney epithelial cells		HEK293	
CLO:0050896	RCB1275 cell	"Derived from tissue: kidney in animal: human.|Originator: Liu Shu Qin|Register: Kawai, Kouji & Ohno, Tadao"		RCB1275|TUHR10TKB			immortal human kidney-derived cell line cell		A immortal human kidney-derived cell line cell that has the characteristics: Japanese renal carcinoma cells expressing HLA-A2402. Cell growth is slow.			
CLO:0050983	RCB1428 cell	"Derived from tissue: blood in animal: human.|Originator: Hamaguchi, Hiroyuki|Register: Hamaguchi, Hiroyuki"		FKH-1|RCB1428			immortal human blood cell line cell		A immortal human blood cell line cell that has the characteristics: Acute myeloid leukemia with dek/can chimera mRNA expression. Responding to G-CSF and differentiate.			
CLO:0051228	HEV0041 cell	"Register: Imai, Takashi"		HEV0041			immortal human B cell line cell		"A immortal human B cell line cell that has the characteristics: Human B lymphocytes transformed by Epstein-Barr Virus. HLA A*02:01 A*24:02, B*07:02 B*35:01, C*03:03 C*07:02, DRB1*01:01 DRB1*08:02, DQB1*04:02 DQB1*05:01, DPB1*02:01 DPB1*04:02"			
CLO:0051333	HSC0107 cell	"Register: Danjoh, Inaho"		COLO205|HSC0107			immortal human B cell line cell		A immortal human B cell line cell that has the characteristics: Human B lymphocytes transformed by Epstein-Barr Virus. This B cell lines derived from Mongoloid Minority Groups in South America.			
CLO:0051371	RCB2098 cell	"Derived from tissue: esophagus in animal: human.|Originator: Nishihira, Tetsuro|Register: Obinata, Masuo"	CHEMBL: CHEMBL3308525|CVCL: CVCL_1766|Sanger: COSMIC ID:753623	RCB2098|TE-8			immortal human esophagus-derived cell line cell		A immortal human esophagus-derived cell line cell that has the characteristics: Human cell line derived from esophageal cancer. Moderately differentiated squamous cell carcinoma. TKG0259(Deposited from Tohoku Univ.).			
CLO:0051542	RCB0483 cell	"Derived from tissue: bone marrow in animal: human.|Originator: Seeger, R. C.|Register: Nishi, Yoshisuke"		LA-N-1|RCB0483			immortal human bone marrow-derived cell line cell		A immortal human bone marrow-derived cell line cell that has the characteristics: N-myc gene amplification			
CLO:0051567	RCB1902 cell	"Derived from tissue: tongue in animal: human.|Register: Obinata, Masuo"	CHEMBL: CHEMBL3308109|CVCL: CVCL_1289|JHSF: JCRB0624	HSC-4|RCB1902			immortal human tongue-derived cell line cell		A immortal human tongue-derived cell line cell that has the characteristics: Human tongue squamous cell carcinoma derived cell line. TKG0489 (Deposited from Tohoku Univ.).			
CLO:0051568	RCB1974 cell	"Derived from tissue: tongue in animal: human.|Originator: Takahashi, K.|Register: Obinata, Masuo"	CHEMBL: CHEMBL3308781|CVCL: CVCL_1675|JHSF: JCRB0260	RCB1974|SAS			immortal human tongue-derived cell line cell		A immortal human tongue-derived cell line cell that has the characteristics: Human cell line derived from tongue cancer. Squamous cell carcinoma. TKG0470(Deposited from Tohoku Univ.).			
CLO:0051569	RCB1975 cell	"Derived from tissue: tongue in animal: human.|Originator: Momose, F.|Register: Obinata, Masuo"	CHEMBL: CHEMBL3307947|CVCL: CVCL_1288|JHSF: JCRB0623	HSC-3|RCB1975			immortal human tongue-derived cell line cell		A immortal human tongue-derived cell line cell that has the characteristics: Human tongue squamous cell carcinoma cell line. HLA-A 2/24. TKG0484(Deposited from Tohoku Univ.).			
CLO:0051596	RCB2657 cell	"Derived from tissue: rectum in animal: mouse, BALB/c.|Register: Fukuda, Hiroshi"		Colon-26|RCB2657			immortal mouse cell line cell|immortal rectum-derived cell line cell		A immortal mouse rectum-derived cell line cell that has the characteristics: Mouse cell line derived from rectal cancer. BALB/c strain.TKG0518(Deposited from Tohoku Univ.).			
CLO:0051609	RCB0881 cell	"Derived from tissue: mammary gland, pleural fluid in animal: human.|Originator: Sawada, Tetsuji|Register: Sawada, Tetsuji"	CHEMBL: CHEMBL3308245|CVCL: CVCL_1621|Sanger: COSMIC ID:909256	OCUB-M|RCB0881			immortal cell line cell		"A immortal human mammary gland-derived cell line cell that has the characteristics: Same as OCUB-1, OCUB-F. Chromosome = pseudotetraploid."			
OBI:0000047	processed material								Is a material entity that is created or changed during material processing.			
OBI:0000953	processed specimen						processed material|specimen	specimen and ('processed material' and specimen)	A specimen that has been intentionally physically modified.			
OBI:0001479	specimen from organism			tissue specimen			specimen		"A specimen that derives from an anatomical part or substance arising from an organism. Examples of tissue specimen include tissue, organ, physiological system, blood, or body location (arm)."			
OBI:0001875	cultured immune cell population			immune cell culture sample			cultured cell population		a cultured cell population comprised of a single type of immune system cell			
OBI:0100051	specimen								A material entity that is collected for potential use as an input upon which measurements or observations are performed.			
OBI:0100060	cultured cell population	"The extent of a 'cultured cell population' is restricted only in that all cell members must share a propagation history (ie be derived through a common lineage of passages from an initial culture). In being defined in this way, this class can be used to refer to the populations that researchers actually use in the practice of science - ie are the inputs to culturing, experimentation, and sharing. The cells in such populations will be a relatively uniform population as they have experienced similar selective pressures due to their continuous co-propagation. And this population will also have a single passage number, again owing to their common passaging history. Cultured cell populations represent only a collection of cells (ie do not include media, culture dishes, etc), and include populations of cultured unicellular organisms or cultured multicellular organism cells. They can exist under active culture, stored in a quiescent state for future use, or applied experimentally."		cell culture sample			has_part some 'processed material'|processed material		A processed material comprised of a collection of cultured cells that has been continuously maintained together in culture and shares a common propagation history.			processed material
OBI:0100067	bronchial alveolar lavage			BAL			derives_from some lung|processed specimen|specimen from organism		"Group of biomaterials present in the bronchial aveolar space of an organism which are collected through lavage including the reagents used to for the lavage process, organisms, cells, and cellular secretions present in the bronchial aveolar space."		lung	
OBI:1110041	lymph node cell specimen						processed specimen|specimen from organism		"A cell specimen comprised of a mixed population of cells obtained by processing whole lymph node into individual cells, typically performed using a sieve. This population includes T cells, B cells, macrophages, and other cell types."			
OBI:1110043	cultured adherent cell population			adherent cell culture sample			cultured cell population		A mixed cell population that is characterized by its ability to bind to tissue culture flasks or plates. This population typically contains macrophages and other cells capable of playing the antigen presenting cell role.			
OBI:1110050	cultured CD4- T cell population			CD4- T cell culture sample			cultured immune cell population		A T cell population characterized by not expressing the CD4 molecule on its surface.			
OBI:1110051	cultured CD8- T cell population			CD8- T cell culture sample			cultured immune cell population		A T cell population characterized by not expressing the CD8 molecule on its surface.			
OBI:1110052	cultured CD4-/CD8- T cell population			CD4-/CD8- T cell culture sample			cultured CD4- T cell population|cultured CD8- T cell population		A T cell population characterized by not expressing the CD4 nor the CD8 molecule on its surface.			
UBERON:0000002	uterine cervix					BTO:0001421|BTO:0002249|CALOHA:TS-0134|EFO:0000979|EMAPA:29927|EV:0100114|FMA:17740|GAID:376|MA:0000392|MAT:0000292|MESH:D002584|NCIT:C12311|OpenCyc:Mx4rvVipEJwpEbGdrcN5Y29ycA|SCTID:181453009|UMLS:C0007874|VHOG:0001359|Wikipedia:Cervix|galen:CervixUteri|http://en.wikipedia.org/wiki/Cervix|http://linkedlifedata.com/resource/umls/id/C0007874|http://www.snomedbrowser.com/Codes/Details/181453009	organ part|part_of some uterus|reproductive structure		"Lower, narrow portion of the uterus where it joins with the top end of the vagina."	uterus		
UBERON:0000007	pituitary gland	"Terminology note: hypophysis and pituitary gland are often used informally as synonyms, but the hypophysis also includes the small infundibular or pituitary stalk[Neumann 2020]"				AAO:0010536|BAMS:PIT|BAMS:Pit|BIRNLEX:1353|BM:Die-Hy-HY|BTO:0001073|CALOHA:TS-0798|DHBA:10505|EFO:0000857|EHDAA2:0001471|EHDAA:2183|EHDAA:4477|EMAPA:35998|EV:0100132|FMA:13889|GAID:457|HBA:4634|MA:0000176|MAT:0000077|MESH:D010902|MIAA:0000077|NCIT:C12399|OpenCyc:Mx4rv6NQYJwpEbGdrcN5Y29ycA|SCTID:181125003|TAO:0000118|UMLS:C0032005|VHOG:0000143|Wikipedia:Pituitary_gland|XAO:0000017|ZFA:0000118|http://braininfo.rprc.washington.edu/centraldirectory.aspx?ID=399|http://braininfo.rprc.washington.edu/centraldirectory.aspx?ID=399|http://en.wikipedia.org/wiki/Pituitary_gland|http://linkedlifedata.com/resource/umls/id/C0032005|http://www.snomedbrowser.com/Codes/Details/181125003|neuronames:399	endocrine gland|has_part some 'endocrine cell'|has_part some 'endocrine gland'|has_part some 'epithelial cell'|has_part some 'glial cell'|has_part some 'multi-tissue structure'|has_part some 'native cell'|has_part some 'organ part'|has_part some 'reproductive gland'|has_part some neuron|part_of some 'multi-tissue structure'|part_of some brain|reproductive gland|reproductive organ		The pituitary gland is an endocrine gland that secretes hormones that regulate many other glands [GO]. An endocrine gland located ventral to the diencephalon and derived from mixed neuroectodermal and non neuroectodermal origin [ZFIN].	brain|multi-tissue structure		endocrine cell|endocrine gland|epithelial cell|glial cell|multi-tissue structure|native cell|neuron|organ part|reproductive gland
UBERON:0000010	peripheral nervous system					AAO:0000429|BAMS:PNS|BILA:0000081|BIRNLEX:1111|BTO:0001028|CALOHA:TS-0808|EFO:0000891|EHDAA2:0001445|EHDAA:2893|EMAPA:16665|EV:0100335|FBbt:00005098|FMA:9903|GAID:715|MA:0000218|MAT:0000338|MESH:D017933|MIAA:0000338|NCIT:C12465|SCTID:362292005|TAO:0000142|UMLS:C0206417|UMLS:C1305921|VHOG:0000399|Wikipedia:Peripheral_nervous_system|XAO:0000178|ZFA:0000142|http://braininfo.rprc.washington.edu/centraldirectory.aspx?ID=3232|neuronames:3232	organ system subdivision		"A major division of the nervous system that contains nerves which connect the central nervous system (CNS) with sensory organs, other organs, muscles, blood vessels and glands."			
UBERON:0000020	sense organ					AEO:0000094|BSA:0000121|BTO:0000202|CALOHA:TS-2043|EHDAA2:0001824|EHDAA:500|EMAPA:35955|FBbt:00005155|GAID:63|HAO:0000930|MA:0000017|MESH:D012679|NCIT:C33224|SCTID:244485009|UMLS:C0935626|VHOG:0001407|WBbt:0006929|http://linkedlifedata.com/resource/umls/id/C0935626|http://www.snomedbrowser.com/Codes/Details/244485009	organ		An organ that is capable of transducing sensory stimulus to the nervous system.			
UBERON:0000029	lymph node		https://github.com/obophenotype/uberon/issues/650			BTO:0000784|CALOHA:TS-0579|EFO:0000872|EMAPA:35523|EV:0100050|FMA:5034|GAID:947|MA:0000139|MAT:0000442|MESH:D008198|NCIT:C12745|NCIT:C33027|OpenCyc:Mx4rwLPqLpwpEbGdrcN5Y29ycA|SCTID:181756000|TAO_RETIRED:0005318|UMLS:C0024204|VHOG:0001273|Wikipedia:Lymph_node|ZFA_RETIRED:0005318|galen:Lymphnode|http://en.wikipedia.org/wiki/Lymph_node|http://linkedlifedata.com/resource/umls/id/C0024204|http://www.snomedbrowser.com/Codes/Details/181756000	has_part some 'anatomical conduit'|has_part some 'bodily fluid'|has_part some 'connective tissue'|has_part some 'lymphoid tissue'|has_part some 'multi-tissue structure'|has_part some 'organ part'|immune organ		"Any of the rounded masses of lymphoid tissue that are surrounded by a capsule of connective tissue, are distributed along the lymphatic vessels, and contain numerous lymphocytes which filter the flow of lymph."			anatomical conduit|bodily fluid|connective tissue|lymphoid tissue|multi-tissue structure|organ part
UBERON:0000061	anatomical structure					AAO:0010825|AEO:0000003|BILA:0000003|CARO:0000003|EHDAA2:0003003|EMAPA:0|FBbt:00007001|FMA:305751|FMA:67135|GAID:781|HAO:0000003|MA:0003000|MESH:D000825|SCTID:362889002|TAO:0000037|TGMA:0001823|VHOG:0001759|XAO:0003000|ZFA:0000037|http://dbpedia.org/ontology/AnatomicalStructure|http://dbpedia.org/ontology/AnatomicalStructure|http://www.snomedbrowser.com/Codes/Details/362889002	material anatomical entity		Material anatomical entity that is a single connected structure with inherent 3D shape generated by coordinated expression of the organism's own genome.			
UBERON:0000062	organ					BIRNLEX:4|CARO:0020004|EFO:0000634|EMAPA:35949|ENVO:01000162|FMA:67498|MA:0003001|NCIT:C13018|OpenCyc:Mx4rv5XMb5wpEbGdrcN5Y29ycA|OpenCyc:Mx4rwP3iWpwpEbGdrcN5Y29ycA|SCTID:272625005|UMLS:C0178784|WBbt:0003760|Wikipedia:Organ_(anatomy)|http://en.wikipedia.org/wiki/Organ_(anatomy)|http://linkedlifedata.com/resource/umls/id/C0178784|http://www.snomedbrowser.com/Codes/Details/272625005	anatomical structure|has_part some cell		Anatomical structure that performs a specific function or group of functions [WP].			cell
UBERON:0000064	organ part					AAO:0011124|BIRNLEX:16|EFO:0000635|FMA:82472|SCTID:113343008|SCTID:91717005|http://www.snomedbrowser.com/Codes/Details/113343008|http://www.snomedbrowser.com/Codes/Details/91717005	anatomical structure|has_part some cell|part_of some organ		A multicellular structure that is a part of an organ.	organ		cell
UBERON:0000170	pair of lungs					FMA:68877|OpenCyc:Mx4rvVjKy5wpEbGdrcN5Y29ycA	has_part some lung|material anatomical entity|part_of some 'compound organ'|part_of some 'subdivision of tube'		The pair of anatomical structures comprised of a left lung and right lung.	compound organ|subdivision of tube		lung
UBERON:0000174	excreta					AEO:0000184|BTO:0000491|EHDAA2_RETIRED:0003184|ENVO:02000022|FMA:9674|galen:Excretion	organism substance		A portion of organism substance that is the product of an excretion process that will be eliminated from the body. An excretion process is elimination by an organism of the waste products that arise as a result of metabolic activity.			
